Name,BestArchetypePvE,BestArchetypePvP,PvEScore,PvPOffenseScore,PvPDefScore,DemoPrelimScore,DemoBossScore,Pros,Cons,Notes
"Mother Harlot",Any,T,2,5,5,1,1,"Babylon Goblet drains MP from all enemies while providing her MP sustain, allowing her to loop the same attack over and over even without Divine Brands. With Panel 2 unlocked, she will additionally spread charm all over the enemy's team.
Teal gives her Drain Phys, ideal for pairing with Rama. Notably, she is the only Drain Phys unit that can function as a magic sweeper. Innate Drain Elec also helps to soft-counter Atropos, as the second part of Passionate Rage will not proc if the first Elec part is Anti-Pierced.
Has access to discounted Debilitate in Yellow, letting her play a more support role if needed.
Works very well in a slow Ailment Team, or with Alice A in MP denial teams.
Incredible set of Panels. With Panel 3 unlocked, she can keep enemies permanently charmed by reapplying Charm each turn.","Weak to Force
Full Almighty kit means she is shut down hard by Five Elements.
Low AGI and high MP costs makes her unsuitable for fast teams.","The MP drain aspect of Babylon Goblet is less useful for PVE, as the AI has infinite MP. It does allow you to replenish her MP indefinitely though."
"Nebiros",TP,TP,4,4,4,1,1,"Call of the Dead is the only revive skill in the game without a usage limit. This enables infinite revives especially if paired with healing support like Nadja.
As Call of the Dead triggers at the end of the enemy turn, it lets you start your turn with full press turns, and proc any start of turn chain effects like Archangels.
Hand of Glory provides AOE Curse + Luster Candy on ally death. The Curse is great setup for Alice A (and his own passive) while the buffs increase your likelihood of surviving the turn.
Highest LUK in the game paired with innate Epitome of Madness makes him a great Dodge tank.
Panel 2 grants Null Mortal which makes him even harder to kill.","Hard countered by Null Curse and revive sealing skills like Sword of Actuation. Panel 1 Clotho in particular is a very powerful counter, as she confers the whole team Null Curse.
Weak to light and by extension the Archangels matchup. Teal fixes this somewhat but you lose Null Bind in return.
Call of the Dead can be mitigated by a Cleric removing Curse before end of the turn.","-"
"Nergal",RP,P,1,3,3,4,2,"Plague of Babylon removes Barriers and has a very high chance of landing Weak status, making him incredible setup for Ailment Teams.
High STR, Auto-Tarukaja and increased Accuracy from Meslamtaea make him a decent Physical demon, especially when Paneled.
Auto-Rebellion on Poison boosts his damage and synergizes with Pale Rider.","Weak to Ice
Ailments fall flat in late/endgame PvE because of inflated enemy stats
Hard countered by Ailment Cleansers like Daisoujou or Kinmamon in PVP.
AGI too low for Ailment Teams standards.","P3 Samael offers similar barrier break without consuming a Press Turn. This is vital versus double Intimidating Stance Teams, as Nergal consuming a Press Turn means you are left with a single Press for casting a true ailment.
Compared to P3 Samael, Nergal gives your other demons more flexibility in choosing brands, as they can forego Ailment Infliction completely. Weigh the extra Press Turn versus stat flexibility carefully."
"Nero☆",Any,RP,3,3,2,5,3,"Overture deals Piercing damage while giving him free Concentrate, letting him sweep hard.
Voltage synergises perfectly with Overture and gives your party attack and accuracy/evasions buffs.
Very good for Democalypse where he does not have to worry about MP issues and can repeatedly spam Concentrated Overtures while on Spell Brands for insane damage.","Hard countered by Anti-Pierce, as Overture will not autocast Concentrate (and by extension Voltage) if the attack hits into NDR.
Mediocre stats, relies on Concentrate from Overture to deal damage.
No ST skills if not in Red.
High MP costs and no MP recovery prevent him from spamming his spells freely.","Limited-time Collaboration unit. Nobody knows if he will be rerun."
"Norn",C,C,3,1,1,2,4,"Moment of Fate procs Dekaja + Luster Candy on the boss wave. This is great for PVE content with Auto-Debilitate such as Brands of Sin Sloth 11 and 12 stages and certain Kiwami.
High MAG Stat plus innate Merciless Blow makes her a great demon for Democalypse (provided you transfer an offensive skill).
Recovery Amp and discounted Mediarahan let her function as a PVE Healer with a decent offensive presence.","Has no offensive skills despite possessing Merciless Blow. Heavily relies on transfers for an offensive presence or at least do more than heal.
Not really better than Amaterasu and Barong as a PVE healer/support.
Only obtainable through Democalypse grinding.","Will be very good in upcoming Dark/Light Alter World content.
As the AI will not cast debuffs in Democalypse, Abaddon A still has an edge over her being able to provide both buffs and debuffs."
"Orcus",Y,Y,3,4,4,1,1,"One of the strongest support demons in the game. Law of Hell denies bonus turns when striking weakness, while Hell's Gate grants AOE damage reduction for each open weakness.
This eliminates the need to cover weaknesses for all your demons, allowing them to inherit more valuable transfer skills like Epitome of Fortitude, Recarmdra, Auto-Tarunda etc.
Very good buff control with War Cry and Nocturne in Yellow.","Hell's Gate damage reduction does not apply to single target attacks.
Very MP Hungry. Divines help with MP costs but reduce his bulk.
Needs specific team compositions to work well.","You still receive extra damage from open weaknesses.
Due to the way Law of Hell is coded, it will also deny bonus turns gained from a Crit if the attacked demon has a Physical weakness. This ironically makes Slime a great partner for him, as Slime has six open weaknesses including Phys."
"Pale Rider",TP,TY,1,3,3,4,2,"Very good in an Ailment Team, as Pestilence will kill any enemy after 2 turns, no questions asked.
Perfect synergy with a set-up based sweeper Nergal. Nergal helps to remove any barriers and ensures Plague's poison can land via Weak, which in turn triggers his own Meslamtaea passive.
Gains the strongest debuff Debilitate in Yellow, letting him double as a debuffer.","Weak to Elec
Ailments generally fall flat in late/endgame PvE because of inflated enemy stats
Hard countered by Ailment Cleansers like Daisoujou or Kinmamon in PVP.
Pestilence only kicks in at the end of enemy's turn, giving them one whole turn to cleanse it away or just outright kill him.
Requires a specific team built around him to really work.
Panels 1 and 2 don't contribute to the Ailment build.","-"
"Quetzalcoatl",Any,TP,2,2,2,4,1,"Usually run as a support demon. Ce Acatls' Return is an incredible ressurection spell that brings all fallen party members back to life.
Repel Phys in Teal pairs well with Alilat or Atavaka as an Anti-Pierce unit.
Has 2 strong AOE spells, 3 if in Red.","High MP costs
Weak to Dark
Low Magic stat wastes his AOE potential, despite having good spells and panels.","-"
"Quetzalcoatl A",P,RP,4,5,5,5,3,"Has full Fire Pierce and Fire Amp by default, plus Butcher in Purple. This makes him a deadly Fire Sweeper for both Fire Democalypse and PVP.
Aztec Pulse costs only 5 MP when maxed and does massive damage when combined with his other passives. The low MP cost also means you can spam it with Divine Brands going first, regardless if Alice A is present or not.
Ce Acatl grants him a free revive once per battle, while refunding the press turn lost from his death. This makes him a great counter for Fast T1 Teams on offense, as anything short of a full team wipe will result in him coming back to life and reverse-sweeping with double Aztec Pulses.
Pairs well with Rama has he has Drain Fire by default. This is especially useful versus Herald team comps to counter Uriel's Sunrise.
Red gives him access to discounted Trisagion, useful versus Fire Anti-Pierce.","Weak to Dark.
Purple has troubles versus Fire Anti-Pierce comps like Atavaka-Vairocana and Rama-Surt.
Hard-countered by Revive Sealing units like Skull Knight.","As press turn count is determined at the start of the round, Ce Acatl press turn generation only cancels out the lost press turn from his death.
Ironically, he also pairs well with his mortal nemesis Skull Knight on defense, as Aztec Pulse will soften up everyone allowing Sword of Actuation to kill anyone his AI desires.
Ce Acatl triggers after Passionate Rage. This allows him to dodge the AOE Chains and abuse any extra Press Turns now available to him."
"Rama",Any,TYP,4,4,4,3,3,"One of only three demons that can negate pierce.
While alive, Drain Pierce will prevent pierce skills from going through Drain resistances and is the cornerstone of the Drain Teams archetype.
Brahmastra is a three-hit Almighty skill that functions as an Endure-breaker.
Good base stats and no weaknesses allow him to fulfill a variety of roles, be it support or sweeper. Yellow Rama can function as a good support demon with discounted Luster Candy whereas Purple gives him Ice Pierce which lets him sweep with Mabufudyne.","Not very bulky
Drain Pierce does nothing versus Almighty.","Teal gives him Drain Ice which pairs well with Drain Pierce and can be used to cheese certain difficult PvE content like Hell's Park Floor 100 and Celestial Gui Xian."
"Raphael",TP,P,3,3,3,2,5,"Tailwind does massive damage against single targets, ideal for Bosses or cleaning up in PVP.
Works well in an Archangel Team.","God's Blessing does not deal damage, unlike Uriel and Gabriel.
Needs team built around him.
Weak to Dark","God's Blessing pairs well with Lakshmi A, as the heal with trigger Diwali and restore MP to your team. This allows you to circumvent Alice A's MP drain, which would otherwise stop Archangel teams in their tracks."
"Red Rider",TP,P,2,3,3,2,1,"Good Str, decent Agi and Luck means he will hit hard without much Accuracy issues.
Blade of Terror deals consistent Fractional damage based on enemies current HP, unaffected by buffs. It will also bypass the accuracy check since it is a fractional skill.
Blade of Terror has high AOE Bind chance when maxed, and can be used Turn 1 due to it's low MP cost.","Blade of Terror falls off later in the fight as it is based on Current HP (and is capped against late game targets in PVE).
No innate Pierce means Panel 2 or a Phys Pierce (weak) transfer is mandatory.
Weak to Ice","Buffs and damage boosts only work on Bloodshed's Physical damage and not Blade of Terror's Fractional damage.
His AI will blindly Blade of Terror into Tetrakarn without taking into account the Bloodshed follow up. This can get him easily killed if he does not have some form of Phys Pierce!"
"Samael",P,P,2,4,4,1,1,"Panel 3 is insanely powerful, providing free Barrier Break and Makara Break at the start of turn without consuming Press Turns.
God's Malice is very good to lock down a single target with multiple Ailments.
Infinite Chakra helps to reduce MP requirements, allowing him to spam God's Malice.
Mana Aid is a great transfer skill.","Weak to Elec
Countered very hard by Daisoujou clearing his ailments and punishing him for using Charm.
Middling AGI hurts battle speed for fast Ailment teams.","Great set of Panels that provide additional Ailment Infliction, reduce MP costs and the aforementioned breaks. Easy 4x4 fusion paths make him a good P3 goal to strive toward.
Compared to Nergal, Panel 3 Samael gives you better Press Turn efficiency, but in return all your other demons will require some degree of Ailment Infliction from brands or transfers. Weigh the extra Press Turn versus stat flexibility carefully.
Panel 3 pairs well with Alice A and Nebiros teams, allowing them to land Curse without worrying about Barriers. He also negates Xi Wangmu's Panel 2, as he will continuously break her recasted Barriers each turn."
"Schierke",Any,Any,3,1,1,4,2,"Summon Elementals debuffs a fixed stat depending on Element. The Rakunda effect from Fire Elemental Summon makes her particularly good for Fire Democalypse.
Access to three elements and innate Mana Aid makes her a useful PvE and Democalypse sweeper.","You are at the AI's Mercy on which Element gets casted.
Summon Elementals is only useable once every two turns.
Both her skills have levels, making her a very costly investment Kasane-wise.
No pierce on Elemental Magic.","-"
"Seraph",C,C,3,1,1,2,5,"Very high Magic stat, combined with Garden of Eden and Merciless Blow lets him hit weaknesses hard.
Innate Trisagion and Thunderclap deal massive damage when targeting weakness.
Garden of Eden provides a teamwide boost to damage on hitting weakness, making him perfect for Democalypse.
Panels give him and his teammates even more damage. Can be used in an Archangel team if banking solely on Uriel and Gabriel's passives.","Only obtainable through Democalypse grinding.
High MP costs make him unsuitable for anything outside Democalypse.
Weak to Ice","-"
"Seth",CT,CT,4,2,2,2,4,"Ouas is a very powerful ST nuke that has a high crit rate and a strong heal.
Extremely high STR and LUK means he will hit hard and crit often.
Teal covers his weakness while Clear gives him an AOE skill in Titanomachia.
Yellow gives him Nocturne which allows him to play a more support-oriented role, especially with innate Debilitate.
Good set of panels that provide him damage, bulk and MP reduction.","Lacks Phys Pierce, reducing his viability in certain areas which require it.
Weak to Fire
Extremely low MAG means Zandyne is a wasted slot.
As nothing in his kit boosts Phys damage, damage booster transfers are mandatory.","-"
"Shiva",R,R,4,3,3,5,3,"High STR, AGI and LUK paired with innate Serial Killer and Vorpal Blade make him an effective Physical Sweeper.
Good candidate for the Hell Gongen team as patches out his biggest weakness - lack of Phys Pierce.
Great set of Panels especially Panel 3 which provides insane MP-cost reduction.
Has three sets of Drain resistances and no weakness if in Teal, making him an ideal teammate for Rama.","Pralaya has a high MP cost and is blocked by Five Elements.
No innate Pierce
Very expensive to fuse.
Weak to Ice","-"
"Shiva A",TP,TP,4,4,5,3,1,"Third Eye is fully unblockable and will go through any elemental NDRs and barriers like Five Elements. It is also treated as a physical attack and as such can Crit.
Ishvara provides auto-Rebellion and passively boosts his accuracy and crit chance.
Insane set of panels that give him everything he needs (accuracy, better ST and reduced MP cost).
Incredible Elemental resistances especially in Teal. All these Elemental Drains make him an excellent partner for Rama - Drain Elec in particular allows him to soft-counter Passionate Rage.","Hard to further boost Third Eye's damage as Almighty has no innate Boost/Amp.
Weak to Force
Very MP Hungry and prone to MP denial teams like Alice A.","Can be run in Hero Masakado T1 Teams for a devastating First Turn Kill."
"Siegfried",R,R,3,3,3,4,4,"Arms Mastery passively boosts his damage and accuracy, letting him sweep hard with discounted Titanomachia in Red.
Innate Drain Phys makes him a decent candidate for Drain Teams.
Incredible set of panels that provide him further damage reduction, Phys Pierce and MP reduction. The Phys Reduction from Panel 1 in particular makes him very useful for Alter World Phys.","High investment - He requires Panels, good transfers and a proper team built around him to really shine.
Mediocre AGI and LUK stats.","Arms Mastery can be stacked with Phys Amp and Epitome of Carnage to skyrocket his Phys damage.
Panel 3 Siegfried is a very good candidate for Hero Masakado T1 Teams, as he can fire off a devastating Titanomachia Turn 1 even against Alice A comps."
"Skull Knight",TP,TP,3,5,5,2,1,"Demons die when they are killed by Sword of Actuation, unable to be revived. This lets him counter Nebiros, Xi Wangmu and Clotho revive strats, making him an exceptional Anti-Meta unit.
Sword of Actuation has a ridiculously low MP cost at max level (5 MP) - Even without Panels it can be cast Turn 1 with War Brands. Panel 2 further reduces it to 4 MP, allowing it to be cast regardless of brands or matchup.
Foe of Demons defensively buffs your team at the start of your opponent's turn, increasing your odds of surviving.
Repel Phys in Teal makes him a good partner for Alilat and Atavaka.","Difficult to boost Sword of Actuation further due to it being Almighty Phys.
Requires a good team setup around him to truly shine.
Middling AGI makes him slightly awkward to fit in fast or slow teams.","Has AI issues when used on defense - AI will occasionally target demons with high HP instead of trying to finish off demons with Sword of Actuation. This can be circumvented by pairing him with sweepers like Hecate or Atavaka to soften everyone up, ensuring Sword of Actuation will kill whoever his AI targets. Auto-Rebellion also supposedly fixes this issue.
Limited-time Collaboration unit. Nobody knows if he will be rerun."
"Surt",CP,C,3,3,3,2,5,"Low AGI, innate Tetra Shift and Intimidating Stance in Clear making him a great candidate for slow Intimidating Stance Teams.
Ragnarok hits like a truck and refunds MP if maxed, allowing him to spam it repeatedly.
Purple provides Fire Pierce if preferred for PVE.","Weak to Ice
No innate Fire Pierce if Clear.","Divine brands are recommended if using him for PVP Defense. Otherwise, his AI will Ragnarok once and then default to spamming Berserker God every other turn, wasting all his damage potential."
"Susano-o",P,P,3,2,2,1,5,"Very powerful Force nuker. Kusanagi hits extremely hard and autocasts Tarukaja to further buff your team's attack.
As Kusanagi is treated as a spell, it bypasses any accuracy checks letting him land it reliably.
Both Kusanagi and Mortal Jihad scale from Phys Attack, allowing him cover two elements decently (albeit without pierce).","No innate pierce.
Weak to Fire","Easy 4x4 fusion paths and good panels make him a decent P3 goal to strive toward."
"Susano-o A",TRP,TP,3,4,4,2,5,"Innate Epitome of Carnage and Master Assassin in purple makes him a terrific Phys powerhouse, especially considering Violent Slash's high Base Power and Crit.
Heavenly Valor punishes enemies who pass when used in PVP Defense teams.
Nulls Phys and Drains Force innately. Gains Drain Phys in Teal which goes well with Rama as Phys Anti-Pierce.","No added Accuracy in his kit. Requires extra Accuracy investment from Brands, Panels or skill transfer to hit reliably.
Weak to Fire
Heavenly Valor can be countered, and misses will trigger passives like Andalucia and Brilliant Wings.","Xi Wangmu is a very oppressive partner for him as her passive helps to keep him (and by extension, Heavenly Valor) alive. She also allows him to forgo bulk stats entirely to focus on damage and accuracy.
Heavenly Valor has lower base accuracy compared to typical Physical AOEs."
"Thor",P,P,3,2,2,2,5,"Mjolnir deals massive damage against single targets, ideal for Bosses and Democalypse.
Panels grant him a lot of damage, making him an ideal Elec mage especially with Elec Pierce in Purple.","Weak to Force
High STR is wasted on him as an Elec Mage. Megaton Raid and Charge are wasted slots.
Random targetting is very hard to use for PVP.","AI is extremely bad on Auto, as Charge will mess him up."
"Tokisada",RP,P,4,3,3,2,5,"Flag of Salvation boosts your entire team's light damage, making him useful for Brands of Sin: Sloth 11 and Light Democalypse. It also passively restores 1 MP to your whole party when clearing a wave.
Amakusa Uprising deals heavy single target damage and can crit. Combined with innate Death Blow and Light Amp in purple, this makes him a very strong Light nuker, especially with Panel 2 unlocked. It also provides your team Tarukaja and Sukukaja buffs, allowing your following demons to hit harder.
Great set of Transferable skills being one of the only two sources of Death Blow and the only source of Auto-Rebellion.","Requires Panel 2 to unlock his full potential for PVP, as being able to guarantee crits for extra turns is very powerful.
Only has pierce through Amakusa Uprising, no Piercing AOE.
Needs accuracy investment for PVP, as Amakusa Uprising can miss.","Light is a very good element in the current Meta, as several popular demons usually do not have it covered (Alice A, Nebiros and Hecate to name a few).
The additional MP from Flag of Salvation allows your other demons to drop Divine Brands and/or Mana Aid in favor for more offensive brands and passives.
Red gives is discounted Mahamadyne. Note that having this unlocked might mess up your Brands of Sin: Sloth 11 runs, as the AI will prioritize it over Amakusa Uprising."
"Trumpeter",Any,P,2,2,2,1,1,"Apocalypse deals heavy Almighty AOE damage while having a high mute chance for a low MP cost.
Access to Concentrate to further increase his damage.
No weaknesses and 2 Nulls give him a lot of flexibility in skill transfers.","Very high MP costs.
Difficult to further boost Apocalypse damage.
Hard countered by Five Elements, plus stiff competition from other Almighty sweepers like Mother Harlot.","-"
"Tzitzimitl",Any,RP,2,3,2,1,1,"Demons die when they are killed by Dark Premonition, unable to be revived.
Revive seal is very useful in certain PVE content (like several AG2 bosses) and to counter Nebiros and Xi Wangmu revive strats in PVP.
High innate dodge rate which compliments the Mute from Dark Premonition.
Red gains discounted Mind Blast, which can be used to further disable enemies. Purple gains Enduring Soul to bolster her survivability.","Needs to be below 50% HP to unlock most of her kit, making her a glass cannon.
Dark Premonition only has mediocre base damage, and can be stopped by Dark Anti-Pierce such as Rama + Masakado.
Mediocre stats.
Ailments fall flat in late PvE because of inflated enemy stats.
Weak to Light","Tzitzimitl bears special mention as a hard-counter to Moirai Sisters, especially for target/revenging. If she can survive Passionate Rage (not hard if you run Purple), she will gain immediate access to Disastrous Eclipse and Star of Darkness, letting her fire off hard-hitting AOE Revive Seals. Pair her with Tlaltecuhtli and fodder demons sporting Auto-Rakunda and Auto-Taruka to get an immediate buff swing."
"Uriel",TP,P,4,4,4,4,5,"One of the core demons in the Archangels archetype. When combined with two other Herald or Divine demons, God's Fire dishes out massive damage even before battle really begins.
God's Fire gives your party a Tarukaja attack buff, and at Panel 2 even adds in a Rakunda debuff, swinging offensive buffs to your favor.
Chain effects do not consume press turns even when hitting NDR.","Needs Team built around him
Chain effects kills demons before they have a chance to talk, making him less useful for Aura Gate.
Weak to Dark","Reflected God's Fire will damage him because of innate pierce. Beware of Alilat and Atavaka.
Requires additional MP Support when going against Alice A teams."
"Vairocana",YP,TP,3,4,4,3,1,"Radiant Mantra constantly resets all buffs and debuffs at the start of enemy turn. When used in a slow team, this allows him to nullify auto-skills, giving your team more flexibility in skill transfer.
Good repel resistances makes him a natural partner for Alilat and Atavaka. Fire and Light repel is especially useful to counter Archangel teams, as it makes him immune to both their AOE elements.
High MAG and Butcher in purple allows him to function as a strong almighty sweeper. In addition to dealing respectable almighty damage, Path of Prominence also applies a mini Luster Candy buff, extending his role as a buff control specialist.
Yellow gives him access to discounted Mediarahan, allowing him to function as a decent PVE Healer.","Very hard to further boost his damage.
Despite wanting to go second to fully abuse Radiant Mantra, his AGI is on the high side.
Very high MP costs. Even with maxed Path of Prominence and Divine Brands, he won't be able to spam it consistently unless Panel 2 is also unlocked.
Full Almighty / non-Piercing kit means he is shut down hard by Five Elements.","Radiant Mantra is very useful for certain PVE content to remove Fast Luster Candy and Fast Debilitate.
Good synergy with Skull Knight - Radiant Mantra will purge away all debuffs, allowing Foe of Demons to guarantee a Sukukaja and Rakukaja buff."
"Vasuki",RP,CP,2,2,2,2,5,"Innate Ice Boost and Butcher in Purple make him a powerful Ice Mage.
Halahala deals massive damage against single targets, ideal for Bosses and Democalypse.
P3 autocasts Rakunda, which is invaluable in Democalypse boss phases where buffs are hard to come by.","Poison (and by extension Insanity) does literally nothing for his Ice builds.
Lacks of pierce and being limited to only random targetting makes him very bad for PVP.
Weak to Fire","-"
"Vishnu",CR,R,2,3,2,1,2,"Good bulk make him a tanky Mage thanks to Avatar.
Gains discounted Megidolaon in Red.
Healing and MP reduction from Panels further his tanky Mage role.
Low AGI makes him ideal for budget slow teams.","Weak to Fire
Low damage output compared to Top Tier demons.
Needs heavy investment in Brands and Panels to be usable in PVP.","Low AGI forces him into slow teams, but slow teams prefer very high damage demons (even if their MP cost is high) rather than demons able to spam low MP-cost low damage attacks."
