Name,BestArchetypePvE,BestArchetypePvP,PvEScore,PvPOffenseScore,PvPDefScore,DemoPrelimScore,DemoBossScore,Pros,Cons,Notes
"Garuda",Any,RP,4,3,3,3,1,"One of the fastest and most flexible demons in the game. With Speedster transferred, he can help your team hit various PVE battle speed requirements, while fulfilling either a support or additional DPS role depending on build.
Vahana provides additional Evasion and can stack with other evasion passives like Evade to make him a dodge tank.
Auto-Rakunda increases your team's damage output and synergizes well with his Turn 1 focus.","Does not have Speedster innately which in turn consumes a skill slots.
Very low bulk
Weak to Ice.","More or less outclassed by Hresvelgr in PVP nowadays.
Red gives him access to discounted Maragidyne, giving him a cheap T1 nuke. Yellow makes him more support-oriented with Fog Breath."
"Garuda A",YP,RP,3,3,3,3,5,"Brilliant Wings fires a Piercing AOE Force attack every time any of your demon successfully dodges an attack. This makes him a powerful pick versus pure physical demons like Masakado and Guan Yu.
Brilliant Wings fits well with evasive demons such as Nekomata A.
Gale Talon is very damaging against lone targets like Bosses, making him very potent for Democalypse. It can also be used for PVP cleanup and/or Endure breaking.","Weak to Ice
Evasion is useless against Magic teams
Gale Talon takes time to reach full potential, reducing his T1 potential.
Needs a team built around him to be really effective","Brilliant Wings will trigger off chain attacks such as Susano-o A's Heavenly Valor. You can use this to your advantage by repeatedly passing against him for free chip damage."
"Gogmagog",T,T,4,3,3,4,3,"Very high bulk, which he can capitalize on thanks to innate Earthquake.
Three weaknesses makes him a good partner for Orcus.
Less competition for Brands compared to your other demons, as he relies on PDEF for damage.
Panels let him play a more support-oriented role, providing team-wide bonuses as long as he is alive.
Repel Phys in Teal pairs well with Alilat or Atavaka for Phys Anti-Pierce.","Abysmal AGI means he misses. A lot.
No innate pierce.","Single target nukes will still hurt him a lot, especially with bonus damage from exploiting his multiple weaknesses."
"Guan Yu",TR,TP,4,5,5,3,4,"No weaknesses and high VIT stats make him very tanky, especially with Life Brands.
High STR and native Phys Pierce make him a physical powerhouse.
Loyal God of War refunds MP and heals him on a kill, giving him insane amounts of self-sustain.
Innate Savage Glee lets him Crit and generate Press Turns effectively, especially if given Epitome of Carnage or paired with Crit boosters like Asura Lord or Kartikeya.
Purple gives him access to Null Mortal, making him even harder to kill.","Low Agi stat means he will have accuracy issues. Dragon Blade's chain effect will not activate if it misses on the first target.
Only has ST skills unless in Red, which reduces his overall PvP usefulness","A Null Curse transfer makes him unkillable by Alice A, and also stops Curse from interfering with Loyal God of War healing.
Highly dependant on the first kill for tempo. Failing to secure the first kill will result in him not having enough MP for the next turn."
"Guts",P,P,4,5,5,5,2,"Extremely high Crit rate thanks to Savage Glee and The Struggler. Butcher in purple further augments his damage.
Dragon Slayer does insane AOE Piercing Physical damage and bypasses Endure-type skills. It can also be cast Turn 1 due to its low MP cost.
Is decently tanky thanks to good bulk and The Struggler providing him a better Enduring Soul.
Panel 1 gives him access to a Piercing Fire AOE that does not cost MP, very useful against MP denial teams.","Having no innate ST skills means he will be walled by Drain Teams. It is recommended to pair him with demons like Alice to eliminate Phys Anti-Pierce demons that prevent him from sweeping.
No natural Pierce outside Panel 2 might cause issues when out of MP.","Limited-time Collaboration unit. Nobody knows if he will be rerun."
"Hecate",P,P,4,5,4,2,5,"Hell's Trivia is a cheap, hard-hitting spell that also functions as an Endure breaker. Coupled with her respectable Mag stat and Dark Enhancement in purple, she can be built as a powerful dark mage.
Virtually immune to ailments thanks to Null Bind and Lunar Awakening. Transferring a cleanse skill like Prayer or Silent Prayer will allow her to function as a cleric, while still maintaining her offensive presence.
Panel 2 lets her run Life or Spell brands without worrying about MP.","Not very bulky due to middling VIT and HP stats.
Weak to light and by extension the Archangels matchup.
As Lunar Awakening only cleanses at the end of the enemy's turn, she can still be killed by Alice A if she is cursed in the same turn (such as through Mahaju).","Innate Repel Dark means she can't be sniped by Alice if paired with Alilat or Atavaka. This is very significant as most dedicated ailment teams run Alice to remove the cleric.
Lunar Awakening only triggers at the end of the enemy's turn. This makes her useless for Brands of Sin Sloth 11, as the ailments trigger at the beginning of the turn."
"Hresvelgr",RP,YP,4,4,4,5,3,"Highest Base AGI in the game, making him invaluable for fast teams.
His unique North Wind deals AOE Ice damage whenever an opposing demon dies. This adds to the damage of fast Turn 1 teams and allows him to clear Endures.
Auto-Rakunda in Purple further increases Turn 1 kill potential.
Decent MAG with innate Ice Boost lets him fire off strong Bufudynes.","No ice pierce.
Does not have Speedster innately which in turn consumes a skill slots.
Weak to Phys and Fire. Phys Weakness is particularly bad unless paired with Orcus for Press Turn denial.","-"
"Huang Di",R,RP,4,2,3,5,3,"Superior Power gives him Phys Pierce and an accuracy boost.
Yinglong Killer hits incredibly hard and has a high crit rate, demolishing teams without anti-Pierce.","As nothing in his kit boosts damage, damage booster transfers are mandatory.
Yinglong Killer has a very high MP cost and cannot be fired off Turn 1.
Below average HP and Vit stats.","More of less outclassed by Guts. Oh how the mighty have fallen!
AI is very unreliable for PvP Defense; will occasionally Yinglong Killer into Anti-Pierce and lose press turns.
Panel 3 healing has some fun applications together with Lakshmi A, allowing him to restore both HP and MP to the whole party upon a crit."
"Huang Long",YP,YP,4,2,2,1,1,"High AGI, incredible resistances and decent bulk make him a coveted PVE support demon.
Five Elements walls magical demons without Pierce, such as Mother Harlot, Trumpeter and non-purple Rama.
Luster Candy in Yellow gives him even more support utility in buff control. Purple provides him Speedster, giving him full flexibility over which skills to transfer.
Trivializes Brands of Sin stage 10, opening up brand farming on Auto.","Pierce bypasses Five Elements.
Five Elements can be removed through Makara Break, most notably by P3 Samael.
Very MP hungry, needs Divine Brands or Mana Aid to function well.","Yellow AI has issues on auto as it will sometimes cast Luster Candy when you want to be spamming Five Elements instead. Due to this, Yellow is mostly recommended for Manual Play, and Purple for Auto-ing."
"Indrajit",P,P,3,4,3,3,5,"Lightning Shower provides incredible burst damage due to its high Base Power combined with Indrajit's high base MAG and innate Master Assassin. It can also be looped indefinitely thanks to its low MP cost and Lord of Clouds refunding 3 MP on kill.
Lord of Clouds provides Elec Pierce and autocasts Five Elements on kill, which completely walls off Almighty attackers like Mother Harlot.
Innate Merciless Blow combined with high damage output makes him very valuable for Democalypse.","Weak to Ice.
Low bulk means he will get killed easily if outsped.","Highly dependant on the first kill for tempo. Failing to kill will result in MP Problems.
Has AI issues when used on defense - AI will occasionally target demons with high HP instead of trying to finish off demons to secure Lord of Clouds activation."
"Ishtar",Y,TY,2,2,2,4,3,"Extremely high MAG stat. Panel 1 further increases her AOE damage.
Her unique spell Mesopotamian Star deals Almighty damage while autocasting Tarukaja and Tarunda. At Panel 3, this further applies Rakukaja and Sukukaja, allowing her to deal damage while simultaneously buffing and debuffing.
Gains Concentrate in Yellow, letting her nuke even harder.","Very high MP costs.
Mesopotamian Star has low base power.
Weak to Force and Dark.
Low AGI stat and bad bulk.","Due to her high MAG and Panel 1 bonus, she works very well as an elemental caster for Democalypse if you can transfer the appropriate elemental spell."
"Ixtab",Any,YP,1,3,3,1,2,"Upon death, Yaxche autocasts an almighty Mortal spell that will instakill the enemy that killed her, bypassing Endure.
Yaxche autocast is almighty Mortal and ignores Endure-type skills.
Yellow gives her access to discounted Mahashibabooon, letting her also function as an Ailment inflictor.","Five Elements and Null Mortal blocks Yaxche, shutting her down.
Most important targets in PvE are immune to Mortal (Bosses, Kiwami Adds etc.)","There is no way to reset her level once you have leveled her up.
You can leave her at Lv 1 to bait the AI into killing her and triggering Yaxche. Pair her with teammates that carry resurrection spells to repeat this cycle like Nebiros and Xi Wangmu.
Leaving her at Lv 1 also sharply drops your battle speed, perfect for slow teams."
"Izanami",RP,P,3,3,3,5,4,"Very high Magic stat. Combined with innate Merciless Blow, her unique Yomotsu Okami and Elec Amp in purple, she will decimate anything weak to Elec or Dark.
Yomotsu Okami provides a teamwide increase to Dark and Elec damage, perfect for Democalypse.
Great set of panels that provide her MP reduction, Elec Pierce and increased damage.","Weak to Fire
Very expensive to fuse
No true AOE spells
Very RNG reliant in Democalypse as you cannot rely on Eileen to weather out bad Bolt Storm rolls.","Panel 2 for Elec Pierce is mandatory for PVP.
Red gives her Hell Gaze, while purple provides Elec Amp. As both are very useful for their respective elemental Democalypse, consider building two of them if your Faction does these elements."
"Jeanne☆",P,P,2,2,2,1,1,"Madama Uppercut autocasts a follow-up Almighty attack upon Charm that also inflicts Bind.
Evade and Madama Uppercut levels increase her evasion and allow her to function as a dodge tank.
Gomorrah (J) has high base damage and crit chance, with a high chance to Bind all enemies.
Pairs well with Bayonetta☆ or any other sources of charm like Lakshmi.","Gomorrah (J) takes two turns to charge, and is difficult to build due to it scaling it off PATK and MATK.
Awkward combination of balanced stats and having both Physical and Magic skills make her pretty mediocre at everything.
Very bad bulk means she will get shredded by Magic teams, which ignore her evasion.
Panels do not benefit her much.","Limited-time Collaboration unit. Nobody knows if she will be rerun.
Pretty much outclassed by P3 Lilith, who does Bind upon Charm better."
"Kali",RP,P,4,3,3,4,5,"Violent Dance deals incredible burst damage to a single target and can be cast T1 even with War Brands (or with Divines if wary of Alice A).
Can reliably crit for press turns thanks to Violent Dance putting her in a state of Rebellion.
Gains Phys Amp in Purple turning her into a true Goddess of Slaughter.
Panel 2 provides an MP refund, allowing her to spam Violent Dance.
Red gives her access to discounted Hades Blast, giving her an AOE skill for PVE.","Weak to Ice.
Requires a state of Rebellion to reach full potential. This mandates either one turn of warm up, or an Auto-Rebellion transfer.
Loses turns if she misses even 1 of 6 Violent Dance hits.","-"
"Kartikeya",C,C,5,4,4,2,2,"Fastest demon in the game especially when passive is maxed, allowing you to hit battlespeed requirements in PVE easily.
Skanda proides teamwide Accuracy and Crit chance boost.
Mortal Jihad plus Great Aim means he will rarely miss, while having a good crit rate to generate press turns for your team.
No weaknesses and innate Speedster gives him great flexibility over transfer slots and lets him fulfill a variety of roles.","No innate pierce means he will have trouble with Tetra Shift, unless you inherit Phys Pierce (weak).
Very expensive to Fuse.","Difficult to Panel due to Clear demons only giving 60 spirits.
Works very well in Turn 1 teams like Hero Masakado T1."
"Lachesis",P,P,2,5,5,1,1,"One of the core demons in the Moirai Sisters archetype. When combined with two other Lady or Femme demons (preferably her two other sisters), Passionate Embrace debuffs their attack and defense while buffing yours. Not only does this make Atropos' Passionate Rage stronger, it also makes it harder for the opponent to fight back as they will have to deal with a massive reduction in damage.
Measured Fate removes all debuffs from your team and buffs from the enemy team. This ensures the following Passionate Embrace will fully swing buffs in your favor.
Intimidating Stance in Purple synergizes well with the rest of the Moirai Sisters who have very low AGI.
Her Panels provide valuable ailment immunity, making it harder for Ailment Teams to sweep her on revenge.","Requires a good team built around her.
Due to the way the Moirai Sisters archetype is typically built, Revive Sealing units like Skull Knight are a very powerful counter.","The AI will not cast Measured Fate if there are no buffs on your opponent and/or debuffs on you. As she does not have any other actives, this causes her to auto-attack most of the time, which can be a problem facing NDR Phys or evasive targets."
"Lakshmi",Any,P,2,3,3,2,3,"Extremely high Magic and Luck stats allow her to be built as either a Sweeper or an Ailment inflictor.
Her High Luck, Insanity combined with Lotus Dance's high Charm rate virtually guarantees she will Charm everything that does not Null it.
Panel 3 allows her to generate MP for the team, enabling certain first-turn kill strats like Shiva A, or counter MP drain teams like Alice A.","Weak to Force
Lack of good innate offensive skills wastes her high MAG stat.
Countered very hard by Daisoujou clearing her charms and punishing her for using them.
Very bad bulk","-"
"Lakshmi A",Y,RP,4,4,4,1,1,"Diwali restores MP to the whole team upon receiving any healing from skills. This includes her own Virtuous perity, passive healing from Hecate/Guan Yu/Raphael and drain-type skills such as Light Devourer and her own Deathtouch.
The MP restoration aspect is very powerful in the current PVP meta as a counter to Alice A's passive MP Drain.
One of the best healers thanks to innate Recovery Amp and Virtuous perity.
At max boost level, Virtuous perity cleanses all Ailments while conferring Five Elements and Null Mortal, making it a powerful support skill for both PVE and PVP.
Yellow grants discounted Defensive Cry, a powerful defensive skill for PVE.","Weak to Force","In Yellow, AI prioritizes Defensive Cry which does not trigger Diwali."
"Lilith",Any,C,2,2,3,3,1,"Two strong Dark and Elec AOE skills.
Decent Magic allows her to deal damage while also inflicting ailments on the enemy.
Panel 3 casts a teamwide Bind whenever an enemy is charmed, and can be triggered multiple times per turn.","Weak to Force and Light
No pierce, requires Dark Pierce (weak) to really shine.
Countered very hard by Daisoujou clearing her charms and punishing her for using them.","Easy 4x4 fusion paths and good panels make her a decent Panel 3 goal to strive toward."
"Lucifer",P,P,3,2,3,4,3,"Morning Star is the most powerful Almighty AOE spell in the game.
Purple gives him Butcher to further augment his damage.
Good bulk especially with Panel 2 unlocked. This helps him live long enough to build up the MP necessary for Morning Star.
Repel Dark is sometimes useful with Alilat or Atavaka against bosses with Dark Pierce.","Weak to Light.
Very MP hungry. Even when paired with P1 Lucifuge, he cannot Turn 1 Morning Star against Alice A teams without dedicated MP support.
Very expensive to fuse and panel.
No Pierce and full Almighty kit means he is shut down hard by Five Elements.","Paired with Panel 1 Lucifuge, you can also use him in a devastating Turn 1 Sweeper team."
"Lucifuge",C,C,3,2,3,3,4,"Hell's Ministry reduces Almighty cost for all Tyrant race demons and improves their bulk. Paired with his Panel 1 Bonus, this will give a whopping 2MP discount and enable powerful Turn 1 combos such as Lucifer's Morning Star.
Light Devourer is a hard-hitting single target Dark spell, further amplified by innate Dark Amp.
Clear gains access to discounted Necro Dogma. As it only costs 6MP when maxed (5MP if Panel 1), it can be fired off Turn 1 and giving your whole party a defensive buff as a bonus.","Weak to Light
Extremely expensive to fuse.
Middling AGI hurts battle speed for fast T1 teams.","Requires Panel 1 to really shine.
Unimpressive without good teammates. His best partner Lucifer is another very expensive fusion, and requires Panel 3 to be really competitive in PVP."
"Mahakala",RP,RP,4,4,3,4,5,"High Magic stats and innate Concentrate + Pierce from The Great Darkness make him a very powerful ST Nuker.
Wrathful Flame reduces defense, allowing your teammates to hit harder. It can also be cast on turn 1 PVP with spell brands if maxed.
Very effective in Democalypse boss rounds as buffs/debuffs are difficult to come by.
Goes through Endure as Wrathful Flame counts as three separate hits.","Combination of ST and AOE in his kit makes it difficult to further boost his damage.","Unlike Indrajit, lack of MP recovery means he cannot spam Wrathful Flame as easily in PVP.
If Mahakala is not alive at the beginning of the turn The Great Darkness won't increase the turn count until Mahakala is revived and survives until the start of the following turn."
"Mara",P,P,3,2,2,3,5,"Only fuseable source of Phys Pierce.
High STR and LUK means he will hit hard and crit often.
Hell Thrust is very strong against bosses and in Democalypse, especially if he is Panel 3.
Meme","Ice Weakness and non-existent bulk makes him go limp at the sight of Ice skills.
High MP costs give Mara a big refractory period.
Expensive to fuse, will quickly blow through your Magnetite reserves.
Requires damage boost transfer to supplement his damage.
Middling AGI means he will have accuracy issues and occasionally miss the hole. Also doesn't slot into Intimidating Stance teams well as a result.
Due to Mara having no single target besides his regular thrust, Anti-Pierce units like Rama, Alilat and Atavaka are a turn off.","-"
"Marici",P,P,2,2,2,1,1,"Shimmer Arrow lets her follow up ANY physical skill with a piercing Light ST nuke. This is great for cleaning up Endures and spreading out chip damage.
Daylight Blade deals Piercing Phys damage while putting her into a state of Concentrate, allowing her chained Shimmer Arrow to hit much harder. This effectively gives her a 300 Base Power ST nuke (360 if it crits!) that also ignores Endures.
Works great in Brands of Sin Sloth 12 where a majority of the enemies are weak to light.","Unimpressive STR stats, low base power on both her skills and no damage boosters in her kit severely hurt her damage output.
Difficult to boost her damage due to her being a dual Physical and Light Hybrid attacker.
Does not have natural Pierce. This can cause issues with his AI attacking into Tetra Shift and/or Physical NDR when out of MP.","For manual play, Shimmer Arrow will hit whoever your cursor is on. On Auto and/or Defense however, you are at the mercy of the AI whoever she snipes."
"Masakado",P,TP,5,5,5,3,3,"Innate Phys Amp in purple combined with a MASSIVE STR stat allow him to dish out ridiculous amounts of Physical damage.
Warlord's Wrath is a loaded passive that combines Intimidating Stance, Faithful Counter and Phys Pierce.
Occult Flash is a high damage, high crit-rate single target skill that will inflict Mortal with 100% chance.
Has no weakness and a perfect base kit, allowing you to tailor his remaining transfer slots however you like.
Gains Drain Phys in Teal, allowing you to pair him Rama to act as a Phys Anti-Pierce unit.","Low Agility leads to accuracy issues, especially against evasive targets.
Is very frail thanks to a low VIT and HP stat.","Unable to be paired with Masakado A. This drops his Democalypse ranking by a decent amount, as Masakado A is a ridiculously powerful tech."
"Masakado A",Any,P,5,5,5,5,3,"Guardian of the East provides 1 extra Press Turn when going first, enabling devastating Turn 1 Kill strats like Hero Masakado T1.
Kuyo Flash can be cast 1st turn and swings offensive buffs entirely in your favor through autocast Tarukaja, Rakunda, Sukukaja and Sukunda.
Panel 2 provides team wide Null Mortal for one turn. This is useful for sweeping Ixtab defenses, or protecting your allies from being counterswept by Alice A if you fail to kill them Turn 1.
Incredible set of resistances with 3 Nulls (Phys, Dark, Light) and no weakness allows you to tailor the rest of his transfer slots however you please.","No good physical attacks to exploit his innate Phys Pierce. Only Phys attack available to him is Myriad Arrows in Red which has random targeting and is thus not very reliable.
Easily countered by outspeeding. This is a problem for last hour PVP, as Masakado A defenses will get relentlessly targetted by players looking to climb last minute.","Unable to be paired with Masakado"
"Mastema",P,P,3,2,3,5,3,"Good Magic coupled with Trial of Hate's high base power makes him an incredible Light sweeper. The debuff is icing on the cake.
Good set of resistances with 1 Null and 2 Reflects.
Works well in Archangel Teams to provide more sweeping power.
Laughs at his enemies occasionally","No innate pierce, requires Light Pierce (weak) to really shine.
Weak to Fire. This is especially problematic in Brands of Sin: Sloth 11 and above, as the boss has innate Trisagion.
Binding Cry, while a flavorful skill is unfortunately wasted on Mastema.","Easy 4x4 fusion paths and good panels make him a decent Panel 3 goal to strive toward."
"Maya",YP,P,3,3,3,1,1,"Will virtually never have MP issues thanks to Glamorous Allure giving her a free Almighty AOE attack that has a chance of charm.
Upon any allies being Muted, she will counter with Illusionary World, cleansing the Mute and retaliating with an Almighty AOE Sweep. This makes her ideal for punishing Daisoujou, whose team will take chip damage from Illusionary World every time his Preach is triggered.
Innate Null Charm, Null Bind in purple and Illusionary World makes her virtually immune to skill-restricting ailments. Transferring a cleanse skill like Prayer will allow her to serve as the team's Cleric, while still being able to deal chip damage thanks to Glamorous Allure.
High LUK and huge amount of built-in Ailment Infliction help her land Charm from Glamorous Allure reliably.","Fairly mediocre MAG and unimpressive Base Power on both skills hurt her damage potential.
Very harshly countered by Five Elements on Defense, as the AI does not know how to pass and will lose press turns attacking into it.","-"
"Metatron",R,CY,3,2,3,4,4,"Good HP and Vit stats paired with great resistances gives him decent of bulk, especially with innate Enduring Soul in Clear.
High Magic stat and Infinite Chakra lets him function well as a magic sweeper.
Works well in an Archangel Team, as Fire of Sinai is great for cleaning up and breaking Endures.
Gains discounted Mahamadyne in Red which is great for Brands of Sin Sloth 10 and 11 farming.
Panel 3 amplifies all Magic damage.","Very difficult to fuse, only 1 recipe available.
Full Almighty / non-Piercing kit means he is shut down hard by Five Elements.
Low AGI stat penalizes him in the Archangels PVP strat.","-"
"Michael",TY,T,3,1,1,2,5,"Soul Judgement deals massive damage against single targets, ideal for Bosses and Democalypse.
While he has pretty mediocre MAG stats, panels help to offset this by providing him a lot of damage.
Yellow gives him access to discounted Mediarahan, allowing him to double as a healer.
Very good set of resistances, especially in Teal.","Weak to Dark
No innate Pierce and mediocre Stats
High STR stat is wasted on a Mage.
Random targeting is ill-suited for PVP.","-"
"Mot",Any,YRP,3,3,2,5,5,"His high bulk pairs well with Harmonious Death which is strong in extended fights.
Harmonious Death makes Mot a must-have in Democalypse Prelim teams. At Panel 3, he becomes perfect for Democalypse Boss teams.
Has two strong AOE spells.
Amazing set of panels that provide him MP reduction, Null Mortal and even more Press Turns.","Weak to Elec
High MP costs","-"
"Mozgus",R,TY,2,2,2,2,2,"The only unit in the game that has a Critical Counter, God 1000 Fist Cannon will unleash a random barrage of piercing Physical attacks whenever the enemy scores a crit.
Extremely high bulk and damage reduction from Bloody Scripture make him a powerful tank. Building him as a tank also increases God 1000 Fist Cannon and Muscle Punch damage, as they both depend on Phys DEF for damage. Earthquake in red furthers this synergy.
Yellow gives him access to discounted War Cry, letting him play a support role if required.","God 1000 Fist Cannon has low base power.
Does not have Pierce outside of God 1000 Fist Cannon.
Needs a lot of Accuracy investment due to bad AGI.
Weak to Fire","Limited-time Collaboration unit. Nobody knows if he will be rerun."
